{"adapterContractVersion":1,"envelopeDigest":"sha256:175f2573302dd8f36cf8cd69cf60e0c76a918d5dfe2e881e076170c2f1c094ce","foundation":{"buildIdentity":"sha256:d3b1ac92a741f22bc6ed971310008700d3f89b170a3cabbb317cb09597e639a0","version":"0.21.0"},"journal":{"destination":{"path":"docs/decisions/9001-frozen-adr.md","state":"publishing"},"ownedTemporary":{"digest":"sha256:2b5c091fe48891f907aa8ddc27d763af77b8994eef4a45589c086e9992a3671b","identity":{"adapter":"node-filesystem","birthtimeNs":"1788585184653734636","dev":"64769","ino":"9065794","version":1},"path":"docs/decisions/.foundation-document-cc1ccfa0740503be7ce11394927f5e3e42e1078b2801fd765a1f51b1bedbef37.tmp"},"plan":{"authority":{"metadataSchema":{"digest":"sha256:507a8b906e560e85fdaa5e223bf668b220eeb5402228ccceb66e14abb081be22","path":"docs/metadata.schema.json","size":822},"ownerCatalog":{"digest":"sha256:0a2986edc21a76d65fbae1579d857007830ef6224fde9eb45075cd55f3c37b8f","path":"docs/owners.yaml","size":109},"profile":{"digest":"sha256:b74e3f625f6f94ca134e6c8a8045b407d544e0bb0be12bc88b2481704e19d024","path":"document-authoring.yaml","size":3318},"template":{"digest":"sha256:dc7913072b964c6ae1a4cc711392ddad641dd8df6841ffafb06893fe9d362c6e","path":"docs/templates/adr.md","size":318}},"compiler":{"buildIdentity":"sha256:d3b1ac92a741f22bc6ed971310008700d3f89b170a3cabbb317cb09597e639a0","id":"@agent-teams/engineering-foundation","version":"0.21.0"},"destination":"docs/decisions/9001-frozen-adr.md","destinationPrecondition":{"state":"absent"},"diagnostics":[],"expectedParent":{"ancestry":"real-directories","path":"docs/decisions","state":"directory"},"identityProjection":{"digest":"sha256:944bffe68fd5aefdbcfe83877acd66c148aa0ef7dd3a47842155fc31de21aced","entryCount":2},"intent":{"id":"ADR-9001","owner":"architecture/tooling","schemaVersion":1,"slug":"frozen-adr","summary":"Freezes the current ADR document creation contract.","title":"Frozen ADR","type":"adr"},"intentDigest":"sha256:29c9a221c51121e17eb489b3e924b9eaeb183f3359f96c7a9bf8b307fc3ce493","output":{"contentBase64":"LS0tCmlkOiBBRFItOTAwMQp0eXBlOiBhZHIKc3RhdHVzOiBwcm9wb3NlZApvd25lcjogYXJjaGl0ZWN0dXJlL3Rvb2xpbmcKc3VtbWFyeTogRnJlZXplcyB0aGUgY3VycmVudCBBRFIgZG9jdW1lbnQgY3JlYXRpb24gY29udHJhY3QuCi0tLQoKIyBBRFItOTAwMTogRnJvemVuIEFEUgoKIyMgQ29udGV4dAoKV2hhdCBmb3JjZXMgYSBkdXJhYmxlIGFyY2hpdGVjdHVyYWwgY2hvaWNlPwoKIyMgRGVjaXNpb24KCldoYXQgaXMgZGVjaWRlZCwgaW5jbHVkaW5nIG93bmVyc2hpcCBhbmQgaW52YXJpYW50cz8KCiMjIENvbnNlcXVlbmNlcwoKLSBQb3NpdGl2ZSBhbmQgbmVnYXRpdmUgY29uc2VxdWVuY2VzLgoKIyMgUmVqZWN0ZWQgYWx0ZXJuYXRpdmVzCgotIEFsdGVybmF0aXZlIGFuZCB3aHkgaXQgd2FzIHJlamVjdGVkLgo=","digest":"sha256:2b5c091fe48891f907aa8ddc27d763af77b8994eef4a45589c086e9992a3671b","mediaType":"text/markdown; charset=utf-8","mode":"0644","size":407},"planDigest":"sha256:cc1ccfa0740503be7ce11394927f5e3e42e1078b2801fd765a1f51b1bedbef37","projectId":"orchestrator-qualification","protocolVersion":1,"referencedDocuments":[],"requiredAdapterCapabilities":["create-file-no-replace/v1"],"schemaVersion":1,"selectedOwner":{"id":"architecture/tooling","membershipDigest":"sha256:2ea9861fa5a752b9e4e44b2a019566f59621b8e19f6b7e20f8ab1ed3c2892a26"}},"schemaVersion":2},"operationKind":"document-authoring","payloadDigest":"sha256:f80c50d22d7b3a7de6ddd2abf5d79f3539483a9a77c6d3899c47a1fd8341501f","payloadKind":"document-authoring-journal/v2","recoveryHandler":{"contractVersion":2,"id":"foundation.document-authoring"},"schemaVersion":3,"state":"PUBLISHING"}
