{
  "adapterContractVersion": 1,
  "foundation": {
    "buildIdentity": "sha256:744841136d41d111a96c260a33faef04622b64c626f2ec47b20b632f7fbef44a",
    "version": "0.0.0"
  },
  "journal": {
    "destination": {
      "path": "packages/example/src/features/create-widget/README.md",
      "state": "pending"
    },
    "plan": {
      "authority": {
        "metadataSchema": {
          "digest": "sha256:507a8b906e560e85fdaa5e223bf668b220eeb5402228ccceb66e14abb081be22",
          "path": "docs/metadata.schema.json",
          "size": 822
        },
        "ownerCatalog": {
          "digest": "sha256:0a2986edc21a76d65fbae1579d857007830ef6224fde9eb45075cd55f3c37b8f",
          "path": "docs/owners.yaml",
          "size": 109
        },
        "profile": {
          "digest": "sha256:b74e3f625f6f94ca134e6c8a8045b407d544e0bb0be12bc88b2481704e19d024",
          "path": "document-authoring.yaml",
          "size": 3318
        },
        "template": {
          "digest": "sha256:d23fc1d88fcffe29e7133dfcdaabf6aee4ef8b79da81966a6bec835bb5a44364",
          "path": "docs/templates/feature.md",
          "size": 288
        }
      },
      "compiler": {
        "buildIdentity": "sha256:744841136d41d111a96c260a33faef04622b64c626f2ec47b20b632f7fbef44a",
        "id": "@agent-teams/engineering-foundation",
        "version": "0.0.0"
      },
      "destination": "packages/example/src/features/create-widget/README.md",
      "destinationPrecondition": {
        "state": "absent"
      },
      "diagnostics": [],
      "expectedParent": {
        "ancestry": "real-directories",
        "path": "packages/example/src/features/create-widget",
        "state": "directory"
      },
      "identityProjection": {
        "digest": "sha256:944bffe68fd5aefdbcfe83877acd66c148aa0ef7dd3a47842155fc31de21aced",
        "entryCount": 2
      },
      "intent": {
        "additionalMetadata": {
          "blocked_by": ["OD-001"],
          "code_anchors": [
            {
              "enforcement": "required",
              "pattern": "packages/example/src/features/create-widget/*.ts"
            }
          ]
        },
        "destination": "packages/example/src/features/create-widget/README.md",
        "id": "feature.example.create-widget",
        "owner": "example/create-widget",
        "related": ["ADR-0001", "OD-001"],
        "schemaVersion": 1,
        "summary": "Freezes the current feature document creation behavior.",
        "title": "Create Widget",
        "type": "feature"
      },
      "intentDigest": "sha256:ca0427cdfc441a116db1b138729113251d3fc2f44a7e570574555ebba74989c5",
      "output": {
        "contentBase64": "LS0tCmlkOiBmZWF0dXJlLmV4YW1wbGUuY3JlYXRlLXdpZGdldAp0eXBlOiBmZWF0dXJlCnN0YXR1czogcHJvcG9zZWQKb3duZXI6IGV4YW1wbGUvY3JlYXRlLXdpZGdldApzdW1tYXJ5OiBGcmVlemVzIHRoZSBjdXJyZW50IGZlYXR1cmUgZG9jdW1lbnQgY3JlYXRpb24gYmVoYXZpb3IuCnJlbGF0ZWQ6CiAgLSBBRFItMDAwMQogIC0gT0QtMDAxCmJsb2NrZWRfYnk6CiAgLSBPRC0wMDEKY29kZV9hbmNob3JzOgogIC0gZW5mb3JjZW1lbnQ6IHJlcXVpcmVkCiAgICBwYXR0ZXJuOiBwYWNrYWdlcy9leGFtcGxlL3NyYy9mZWF0dXJlcy9jcmVhdGUtd2lkZ2V0LyoudHMKLS0tCgojIENyZWF0ZSBXaWRnZXQKCiMjIFNjb3BlCgojIyBQdWJsaWMgc3VyZmFjZQoKIyMgT3duZWQgYmVoYXZpb3IgYW5kIGludmFyaWFudHMKCiMjIEFwcGxpY2F0aW9uIHVzZSBjYXNlcyBhbmQgcG9ydHMKCiMjIEFkYXB0ZXJzIGFuZCBjb21wb3NpdGlvbgoKIyMgQ29udHJhY3RzIGFuZCBldmVudHMKCiMjIFBlcnNpc3RlbmNlIGFuZCBjb25jdXJyZW5jeQoKIyMgRmFpbHVyZSBhbmQgcmVjb3ZlcnkKCiMjIFZlcmlmaWNhdGlvbgo=",
        "digest": "sha256:75acb6795c630db3318c15152136dd7c7a0e46b5a0b6f1a245691ea04ab69cdd",
        "mediaType": "text/markdown; charset=utf-8",
        "mode": "0644",
        "size": 569
      },
      "planDigest": "sha256:b15ed0740883ab924c318b0595ce93f947afe831726704fcd7cc56268a8c5a23",
      "projectId": "orchestrator-qualification",
      "protocolVersion": 1,
      "referencedDocuments": [
        {
          "id": "ADR-0001",
          "path": "docs/existing/adr-0001.md",
          "projectionDigest": "sha256:fbd5a663fa317f5d0c83d7c0df1b2436b86016e17575d882ee5abbe708314713"
        },
        {
          "id": "OD-001",
          "path": "docs/existing/od-001.md",
          "projectionDigest": "sha256:9942c5c5551054253976bc9374203c7d37e52eb24ea0d8c43abc67877645214f"
        }
      ],
      "requiredAdapterCapabilities": ["create-file-no-replace/v1"],
      "schemaVersion": 1,
      "selectedOwner": {
        "id": "example/create-widget",
        "membershipDigest": "sha256:10684436816f856460c6c057aa8e2c642464caa6ac6b909ce769b0ab8417678f"
      }
    },
    "schemaVersion": 2
  },
  "operationKind": "document-authoring",
  "payloadDigest": "sha256:b99fb1bd28aa3f0a87257e7ba3fa342f49129210182d1d035f9412373ece308e",
  "payloadKind": "document-authoring-journal/v2",
  "recoveryHandler": {
    "contractVersion": 2,
    "id": "foundation.document-authoring"
  },
  "schemaVersion": 3,
  "state": "PREPARED",
  "envelopeDigest": "sha256:eac1b7d12cf8ba151faf2911284332fef5d6361049ef028c48497f3cab5a877e"
}
